{
  "schema_version": "0.1",
  "automation_id": "server01-runtime-acceptance",
  "display_name": "Server01 Runtime Acceptance Fixture",
  "summary": "Inactive technical fixture that proves Server01 runtime acceptance branches with mocked n8n behavior and no credentials, external calls, or catalogue offering.",
  "ownership": {
    "owner_kind": "shared_internal",
    "owning_program": "linkautowork",
    "classification": "internal_only",
    "binding_operations": [
      "linkautowork.server01-runtime-acceptance"
    ]
  },
  "release": {
    "version": "0.1.0",
    "channel": "development",
    "lifecycle": "draft",
    "identity": {
      "package_digest": "sha256:520900c4b2c179254e5e36892d2f94c164f372b0909c517da019b6baad2196b2",
      "workflow_digest": "sha256:d2e205cd6cfd960803bd0c68c2427969e075bdca321dbf3c8c165d70e509c67c",
      "source_git_sha": "1488779ad1593574957f3abce2775332a31e45c0",
      "n8n_version": "2.30.0"
    }
  },
  "runtime": {
    "engine": "n8n",
    "workflow_ref": "workflow.json",
    "trigger_mode": "manual",
    "result_mode": "none",
    "approved_node_policy": "n8n-core-only-v0.1"
  },
  "contracts": {
    "input_schema_ref": "contracts/input.schema.json",
    "output_schema_ref": "contracts/output.schema.json",
    "configuration_schema_ref": "contracts/configuration.schema.json",
    "invocation_contract_version": "v1"
  },
  "secrets": [],
  "execution_policy": {
    "criticality": "low",
    "side_effects": [
      "none"
    ],
    "approval": {
      "mode": "none",
      "evidence_required": true
    },
    "retry": {
      "max_attempts": 0,
      "backoff": "none",
      "max_delay_seconds": 0
    },
    "idempotency": {
      "required": true,
      "key_location": "request",
      "retention_hours": 24
    },
    "kill_switch_scope": "instance"
  },
  "telemetry": {
    "classification": "internal",
    "redaction_rules": [
      "Do not retain input values beyond the redacted mock fixture.",
      "Never retain credentials or raw n8n payloads."
    ],
    "retention_days": 30,
    "required_fields": [
      "org_id",
      "instance_id",
      "release_id",
      "execution_id",
      "status",
      "latency_ms",
      "retry_count",
      "failure_class"
    ]
  },
  "evaluation": {
    "suite_ref": "evals/suite.json",
    "required_for_certification": true
  },
  "operations": {
    "monitoring_ref": "operations/monitoring.json",
    "maintenance_ref": "operations/maintenance.json",
    "deployment_ref": "operations/deployment.json",
    "runbook_ref": "operations/runbook.md"
  },
  "provenance": {
    "sources_ref": "provenance/sources.json",
    "commercial_use_clearance": "not_applicable"
  },
  "source_authority": {
    "kind": "golden_automation_package",
    "cutover_state": "package_authoritative"
  }
}
