{
  "schema_version": "0.1",
  "automation_id": "golden-example-validation",
  "display_name": "Golden Example Validation Automation",
  "summary": "A non-deployed, side-effect-free n8n example that demonstrates the complete Golden Automation Package v0.1 structure.",
  "ownership": {
    "owner_kind": "shared_internal",
    "owning_program": "linkautowork",
    "classification": "internal_only",
    "binding_operations": [
      "linkautowork.golden-package-validation"
    ]
  },
  "release": {
    "version": "0.1.0",
    "channel": "development",
    "lifecycle": "draft",
    "identity": {
      "package_digest": "sha256:b3307fa719248bcddf6a2b791a41b0a6e52b417db62d926e7c5ff62c073f56c2",
      "workflow_digest": "sha256:efe4955bbb9ae2c364a7db3906d3b80e41b3d09bffad5805a7b7a944b64dafe4",
      "source_git_sha": "a368a45e164eda92eddf1eccad62e58a7c349399",
      "n8n_version": "2.30.0"
    }
  },
  "runtime": {
    "engine": "n8n",
    "workflow_ref": "workflow.json",
    "trigger_mode": "manual",
    "result_mode": "none",
    "approved_node_policy": "n8n-core-only-v0.1"
  },
  "contracts": {
    "input_schema_ref": "contracts/input.schema.json",
    "output_schema_ref": "contracts/output.schema.json",
    "configuration_schema_ref": "contracts/configuration.schema.json",
    "invocation_contract_version": "v1"
  },
  "secrets": [],
  "execution_policy": {
    "criticality": "low",
    "side_effects": ["none"],
    "approval": { "mode": "none", "evidence_required": true },
    "retry": { "max_attempts": 0, "backoff": "none", "max_delay_seconds": 0 },
    "idempotency": { "required": false, "key_location": "not_applicable" },
    "kill_switch_scope": "instance"
  },
  "telemetry": {
    "classification": "internal",
    "redaction_rules": ["Do not retain input values beyond the redacted test fixture."],
    "retention_days": 30,
    "required_fields": ["org_id", "instance_id", "release_id", "execution_id", "status", "latency_ms", "retry_count", "failure_class"]
  },
  "evaluation": {
    "suite_ref": "evals/suite.json",
    "required_for_certification": true
  },
  "operations": {
    "monitoring_ref": "operations/monitoring.json",
    "maintenance_ref": "operations/maintenance.json",
    "deployment_ref": "operations/deployment.json",
    "runbook_ref": "operations/runbook.md"
  },
  "provenance": {
    "sources_ref": "provenance/sources.json",
    "commercial_use_clearance": "not_applicable"
  },
  "source_authority": {
    "kind": "golden_automation_package",
    "cutover_state": "package_authoritative"
  }
}
